I Le Magicien,"https://www.notion.so/130805d5f8c54825a7c8a61682882c01, https://www.notion.so/27d5ca59365c435f89c4121027368a3c, https://www.notion.so/34165b0a55984ba0ba00fa134ff5cb79, https://www.notion.so/8e930ab535b74904bbd4b2db25eb0429, https://www.notion.so/a991a1b7910240059ea2fa497a28eddc, https://www.notion.so/c828903eafcb45789c616d561264a598, https://www.notion.so/e11f7e97f22a4da0977fea4e9f1bc706",,,,"Un jeune personnage vêtu d'une robe de magicien, ayant le visage du divin Apollon, avec un sourire de confiance et des yeux brillants. Au-dessus de sa tête se trouve le signe mystérieux du Saint-Esprit, le signe de la vie, comme une corde sans fin, formant le chiffre 8 en position horizontale. Autour de sa taille se trouve une ceinture de serpent, le serpent semblant dévorer sa propre queue. La plupart des gens connaissent ce symbole conventionnel de l'éternité, mais ici il indique plus particulièrement l'éternité de l'accomplissement dans l'esprit. Dans la main droite du magicien se trouve une baguette levée vers le ciel, tandis que la main gauche est dirigée vers la terre. Ce double signe est connu dans les degrés très élevés des Mystères Institués ; il indique la descente de la grâce, de la vertu et de la lumière, tirées des choses d'en haut et dérivées vers les choses d'en bas. Il s'agit donc de la possession et de la communication des pouvoirs et des dons de l'Esprit. Sur la table devant le magicien se trouvent les symboles des quatre couleurs du Tarot, qui représentent les éléments de la vie naturelle, et qui sont disposés comme des pions devant l'adepte, qui les adapte à sa guise. Au-dessous se trouvent des roses et des lys, le flos campi et le lilium convallium, transformés en fleurs de jardin, pour illustrer la culture de l'aspiration. Cette carte signifie le motif divin dans l'homme, reflétant Dieu, la volonté dans la libération de son union avec ce qui est au-dessus. C'est aussi l'unité de l'être individuel sur tous les plans, et dans un sens très élevé, c'est la pensée, dans sa fixation. En ce qui concerne ce que j'ai appelé le signe de la vie et sa connexion avec le nombre 8, on peut se rappeler que le gnosticisme chrétien parle de la renaissance dans le Christ comme d'un changement ""vers l'Ogdoad"". Le nombre mystique est appelé la Jérusalem d'en haut, la terre où coulent le lait et le miel, l'Esprit Saint et la terre du Seigneur. Selon le martinisme, le 8 est le nombre du Christ.",,"Vie, égo, conscience",0,,1,As/Un (https://www.notion.so/As-Un-291bbf0a48234c84be0a32df14f72e31?pvs=21),✨2,"Se sentir bloqué, créer à partir de l'ego. Médecin, mage, maladie mentale, disgrâce, inquiétude.","Création, manifestation, Habileté, diplomatie, adresse, subtilité ; maladie, douleur, perte, désastre, pièges des ennemis ; confiance en soi, volonté ; le Quérant, si c'est un homme.","Une invitation à prendre vos outils, à la magie personnelle, aux capacités infinies, au partage des messages.",Arcane Majeure : Ligne de Vie,Arcane Majeure : Ligne 1 (https://www.notion.so/Arcane-Majeure-Ligne-1-f39864cb82b24dcd80031d96ebf1e8a4?pvs=21),,,
Neuf de Coupes,"https://www.notion.so/30f59c0f4dd54af4ab2ecb9229fc6423, https://www.notion.so/81486c11e9f74d40866624d6e245e7c8, https://www.notion.so/8e82231fe1f84fe596700cf4ffe5de92, https://www.notion.so/d35ac4e06a4544769b7343950db70a31, https://www.notion.so/db9bdef69fa543ac9e602924e88d8e2f, https://www.notion.so/ec2fb8726d9c4fb995fb63f4cfcd8172",,,,"Un personnage de qualité a festoyé à sa guise, et un rafraîchissement abondant de vin se trouve sur le comptoir arqué derrière lui, semblant indiquer que l'avenir est également assuré. L'image n'offre que le côté matériel, mais il y a d'autres aspects.",💧Eau,"Emotions, Relations",0,,9,Neuf (https://www.notion.so/Neuf-3e80e97e22564b17bc1343bdb2242adb?pvs=21),✨73,"Résistance à vos désirs; Vérité, loyauté, liberté ; mais les lectures varient et comprennent des erreurs, des imperfections, etc.","Écouter vos désirs; Concorde, contentement, bien-être physique ; également victoire, succès, avantage ; satisfaction pour le Querent ou la personne pour laquelle la consultation est faite.",Intégration des enseignements tirés des autres numéros,Coupes,Coupes (https://www.notion.so/Coupes-27f997d58d8d427c917ebcdc8cf6ae77?pvs=21),,,
Sept d’Epées,"https://www.notion.so/232ceea3228d488dbe52286061b73357, https://www.notion.so/81cac96138514faa97222198189699f9, https://www.notion.so/91d74bc899b04031b377fe86d54b60cd, https://www.notion.so/c0d690a20b87430e98ce5ba0ae8f938d, https://www.notion.so/d2993811cf8d4530830ea523a4b37fa4, https://www.notion.so/e6a5e8c12a854790a17202b0f262910b",,,,Un homme en train d'emporter rapidement cinq épées ; les deux autres de la carte restent plantées dans le sol. Un camp est proche.,🌬Air,"Esprit, Imaginaire, Mental",0,,7,Sept (https://www.notion.so/Sept-7a90e004895c4c40b98845c975331b5a?pvs=21),✨57,"Confiance, clarté; Bon conseil, avis, instruction, calomnie, bavardage.","Envie, conflit intérieur, incertitude. Dessein, tentative, souhait, espoir, confiance ; aussi querelle, plan qui peut échouer, contrariété. Le dessein est incertain dans sa signification, car les significations sont largement divergentes les unes des autres.",Travail intérieur,Epées,Epées (https://www.notion.so/Ep-es-bcb057fdbc6f4faab96344f1bddec5bc?pvs=21),,,
VIII La Force,"https://www.notion.so/0f16cb79cc4249b98771ffc5c6396dbd, https://www.notion.so/394b21f3f2c94669b237db5ba0b4aa2d, https://www.notion.so/5e45d9172a5e4969b9de36d5d6bb3b0e, https://www.notion.so/ad97e5932f8c4f27b99ee408fec5c54f, https://www.notion.so/d2cfbe5be31f4282b792e2d02ef5bf9a, https://www.notion.so/d661a1f78b914aef976db67812f3f0a7",,,,"Une femme, au-dessus de la tête de laquelle plane le même symbole de vie que celui de la carte du magicien, ferme les mâchoires d'un lion. Le seul point sur lequel ce dessin diffère des présentations conventionnelles est que sa force d'âme bienfaisante a déjà maîtrisé le lion, qui est conduit par une chaîne de fleurs. Pour des raisons qui me satisfont, cette carte a été interchangée avec celle de la justice, qui porte habituellement le numéro huit. Comme la variation n'entraîne rien de significatif pour le lecteur, il n'y a pas lieu de s'expliquer. La force, dans l'un de ses aspects les plus exaltés, est liée au Mystère Divin de l'Union ; la vertu, bien sûr, opère sur tous les plans, et donc fait appel à tous dans son symbolisme. Elle est également liée à l'innocentia inviolata et à la force qui réside dans la contemplation. Ces significations plus élevées sont, cependant, des questions d'inférence, et je ne suggère pas qu'elles soient transparentes à la surface de la carte. Ces significations supérieures sont toutefois des questions d'inférence, et je ne suggère pas qu'elles soient transparentes à la surface de la carte. Elles sont suggérées de manière cachée par la chaîne de fleurs, qui signifie, parmi beaucoup d'autres choses, le doux joug et le léger fardeau de la Loi divine, lorsqu'elle a été portée dans le cœur des cœurs. La carte n'a rien à voir avec la confiance en soi au sens ordinaire, bien que cela ait été suggéré, mais elle concerne la confiance de ceux dont la force est Dieu, qui ont trouvé leur refuge en Lui. Il y a un aspect dans lequel le lion représente les passions, et celle qui est appelée Force est la nature supérieure dans sa libération. Elle a marché sur l'aspic et le basilic et a foulé aux pieds le lion et le dragon.",,"Transformation, lâcher-prise, approfondissement, l'inconscient",0,,8,Huit (https://www.notion.so/Huit-c63bc808e73246ffae792435b478ce3a?pvs=21),✨9,"Défensive, doute, Despotisme, abus de pouvoir, faiblesse, discorde, parfois même disgrâce.","Force intérieure, Puissance, énergie, action, courage, magnanimité ; également succès complet et honneurs.","Transformation, mouvement",Arcane Majeure : Ligne de Mort,Arcane Majeure : 2ème ligne (https://www.notion.so/Arcane-Majeure-2-me-ligne-97dab140117e45a3a8a808994b8d07fe?pvs=21),,,
Dix de Pentacles,"https://www.notion.so/078e6256b4a54ceb926b752548cd077d, https://www.notion.so/71d29e3962d54dee9fcd4282892726d7, https://www.notion.so/7bdf3c386c8c40769f0beb3925c72e24, https://www.notion.so/8e930ab535b74904bbd4b2db25eb0429, https://www.notion.so/b2b8378ca1b544b8a086eae2d120cd3d",,,,"Un homme et une femme sous une arche qui donne accès à une maison et à un domaine. Ils sont accompagnés d'un enfant, qui regarde avec curiosité deux chiens accostant un ancien personnage assis au premier plan. La main de l'enfant est posée sur l'un d'eux.",🌱Terre,"Corps, fabrication, rapport aux ressources",0,,10,Dix (https://www.notion.so/Dix-9d82c0dfb3ca4e26ae4803dc7c42b459?pvs=21),✨46,"Insatisfaction à l'égard de vos réalisations; Hasard, fatalité, perte, vol, jeux de hasard ; parfois don, dot, pension.","Héritage, sécurité. Gain, richesse ; affaires familiales, archives, extraction, la demeure d'une famille.",Achèvement,Pentacles,Pentacles (https://www.notion.so/Pentacles-6dc23f23bede4957b9abf2c636fd3199?pvs=21),,,
Dix d’Epées,"https://www.notion.so/078e6256b4a54ceb926b752548cd077d, https://www.notion.so/71d29e3962d54dee9fcd4282892726d7, https://www.notion.so/7bdf3c386c8c40769f0beb3925c72e24, https://www.notion.so/8e930ab535b74904bbd4b2db25eb0429, https://www.notion.so/b2b8378ca1b544b8a086eae2d120cd3d",,"March 4, 2023",Tirage du 04 Mars 2023,"Une figure prostrée, transpercée par toutes les épées appartenant à la carte.",🌬Air,"Esprit, Imaginaire, Mental",1,,10,Dix (https://www.notion.so/Dix-9d82c0dfb3ca4e26ae4803dc7c42b459?pvs=21),✨60,"Soulagement de la dépression; L'avantage, le profit, le succès, la faveur, mais rien de tout cela n'est permanent ; également le pouvoir et l'autorité.","Fin, dépression. Tout ce qui est suggéré par le dessin ; également la douleur, l'affliction, les larmes, la tristesse, la désolation. Ce n'est pas spécialement une carte de la mort violente.",Achèvement,Epées,Epées (https://www.notion.so/Ep-es-bcb057fdbc6f4faab96344f1bddec5bc?pvs=21),Tirage du Cœur Estival (https://www.notion.so/Tirage-du-C-ur-Estival-f9ec550a7280458a922eb7cfbaaa88ac?pvs=21),Tirage du 04 Mars 2023 (https://www.notion.so/Tirage-du-04-Mars-2023-059ad0c998d4461880f16d1d0ca1475f?pvs=21),
XVII L’Etoile,"https://www.notion.so/0f16cb79cc4249b98771ffc5c6396dbd, https://www.notion.so/394b21f3f2c94669b237db5ba0b4aa2d, https://www.notion.so/5e45d9172a5e4969b9de36d5d6bb3b0e, https://www.notion.so/ad97e5932f8c4f27b99ee408fec5c54f, https://www.notion.so/d2cfbe5be31f4282b792e2d02ef5bf9a, https://www.notion.so/d661a1f78b914aef976db67812f3f0a7",,,,"Une grande étoile rayonnante à huit rayons, entourée de sept étoiles de moindre importance, elles aussi à huit rayons. La figure féminine au premier plan est entièrement nue. Son genou gauche est sur la terre et son pied droit sur l'eau. Elle verse l'eau de la vie de deux grandes aiguières, irriguant la mer et la terre. Derrière elle, la terre s'élève et, à droite, un arbuste ou un arbre sur lequel se pose un oiseau. La figure exprime la jeunesse et la beauté éternelles. L'étoile est l'étoile flamboyante, qui apparaît dans le symbolisme maçonnique, mais qui y a été confondue. Ce que la figure communique à la scène vivante est la substance des cieux et des éléments. On a dit avec justesse que les devises de cette carte sont ""Eaux de vie gratuites"" et ""Dons de l'Esprit""... Le résumé de plusieurs explications sordides dit que c'est une carte d'espoir. Sur d'autres plans, elle a été certifiée comme étant l'immortalité et la lumière intérieure. Pour la majorité des esprits préparés, la figure apparaîtra comme le type de la Vérité dévoilée, glorieuse dans sa beauté éternelle, déversant sur les eaux de l'âme une partie et une mesure de son inestimable possession. Mais elle est en réalité la Grande Mère dans la Sephira Binah kabbalistique, qui est l'Entendement supérieur, qui communique aux Sephiroth inférieures dans la mesure où elles peuvent recevoir son influx.",,"Renaissance, émergence",0,,17,Huit (https://www.notion.so/Huit-c63bc808e73246ffae792435b478ce3a?pvs=21),✨18,"Ne pas se laisser guérir, surproductivité; Arrogance, hautaineté, impuissance.","Espoir, guérison, renouveau, Perte, vol, privation, abandon ; une autre lecture dit-espoir et perspectives brillantes","Transformation, mouvement",Arcane Majeure : Spirale de Renaissance,Arcane Majeure : 3ème Ligne (https://www.notion.so/Arcane-Majeure-3-me-Ligne-7826df0c5a0f44b6a7670726a851e93a?pvs=21),,,
II La Grande Prêtresse,"https://www.notion.so/45dcdc05ce5143f39a175c8a0c248044, https://www.notion.so/6b332450c461455ea8b55a3c2d44a732, https://www.notion.so/7d601c69d2204d5e8caf5f41a24d6ec0, https://www.notion.so/90262c49ad634373865b83f7c2e9c3ec, https://www.notion.so/a85d694b6bce437ea2304bf23dbfdccb, https://www.notion.so/b06474f617794d3490c3d30c6169cda7, https://www.notion.so/fbaaf63b7e954ea999d02b37912624da",,,,"Elle a le croissant lunaire à ses pieds, un diadème cornu sur la tête, avec un globe à la place du milieu, et une grande croix solaire sur la poitrine. Le parchemin qu'elle tient dans ses mains est inscrit du mot Tora, qui signifie la plus grande loi, la loi secrète et le second sens du mot. Il est partiellement recouvert par son manteau, pour montrer que certaines choses sont sous-entendues et d'autres dites. Elle est assise entre les piliers blanc et noir - J. et B. - du Temple mystique, et le voile du Temple est derrière elle : il est brodé de palmes et de grenades. Les vêtements sont fluides et vaporeux, et le manteau suggère la lumière - un rayonnement chatoyant. On l'a appelée la Science occulte sur le seuil du Sanctuaire d'Isis, mais elle est en réalité l'Église secrète, la Maison qui est de Dieu et de l'homme. Elle représente aussi le Second Mariage du Prince qui n'est plus de ce monde ; elle est l'Épouse et la Mère spirituelle, la fille des étoiles et le Jardin d'Éden supérieur. Elle est, en définitive, la Reine de la lumière empruntée, mais c'est la lumière de tous. Elle est la Lune nourrie par le lait de la Mère Supérieure et, d'une certaine manière, elle est aussi la Mère Supérieure elle-même, c'est-à-dire qu'elle est le reflet lumineux. C'est dans ce sens de réflexion que son nom le plus vrai et le plus élevé dans le bolisme est Shekinah - la gloire cohabitante. Selon le kabalisme, il existe une Shekinah à la fois au-dessus et au-dessous. Dans le monde supérieur, on l'appelle Binah, l'entendement supérieur qui se reflète dans les émanations qui se trouvent en dessous. Dans le monde inférieur, elle est Maikuth - ce monde étant, à cette fin, compris comme un Royaume béni - ce par quoi il est rendu béni étant la Gloire intérieure. Mystiquement parlant, la Shekinah est l'épouse spirituelle de l'homme juste, et lorsqu'il lit la Loi, elle en donne le sens divin. À certains égards, cette carte est la plus élevée et la plus sainte des grands arcanes.",,"Vie, égo, conscience",0,,2,Deux (https://www.notion.so/Deux-2fc9d09967e54e819d63befe47b36334?pvs=21),✨3,"Logique, doute, résistance au mystère, Passion, ardeur morale ou physique, vanité, connaissance superficielle.","Intuition, Les secrets, le mystère, l'avenir non encore révélé ; la femme qui intéresse le Quérant, si c'est un homme ; le Quérant lui-même, si c'est une femme ; le silence, la ténacité ; le mystère, la sagesse, la science.","Dualité, Intuition",Arcane Majeure : Ligne de Vie,Arcane Majeure : Ligne 1 (https://www.notion.so/Arcane-Majeure-Ligne-1-f39864cb82b24dcd80031d96ebf1e8a4?pvs=21),,,
Valet d’Epées,"https://www.notion.so/23c7fe323e1844ecb09c67a778aeba45, https://www.notion.so/62c7cb232f184db485db25fe242d4911, https://www.notion.so/a7127f4e6e6b4554ad705e9a7376206f, https://www.notion.so/f06d93a40e144c27a775c53504d7a7e6",,,,"Un personnage léger et actif tient une épée à la verticale dans ses deux mains, tout en marchant rapidement. Il passe sur un terrain accidenté, et sur son chemin, les nuages sont colocalisés de façon sauvage. Il est alerte et léger, regardant dans tous les sens, comme si un ennemi pouvait apparaître à tout moment.",🌬Air,"Esprit, Imaginaire, Mental",0,,11,Valets (https://www.notion.so/Valets-c8b9e76ce95144e6865ed04a07b0914b?pvs=21),✨61,"Rupture de la communication, confusion; Plus mauvais côté de ces qualités ; ce qui est imprévu, état non préparé ; la maladie est également évoquée.","Activité mentale, communication. Autorité, surveillance, service secret, vigilance, espionnage, examen, et les qualités qui s'y rattachent.",Racines/Fondations,Epées,Epées (https://www.notion.so/Ep-es-bcb057fdbc6f4faab96344f1bddec5bc?pvs=21),,,
VII Le Chariot,"https://www.notion.so/232ceea3228d488dbe52286061b73357, https://www.notion.so/81cac96138514faa97222198189699f9, https://www.notion.so/91d74bc899b04031b377fe86d54b60cd, https://www.notion.so/c0d690a20b87430e98ce5ba0ae8f938d, https://www.notion.so/d2993811cf8d4530830ea523a4b37fa4, https://www.notion.so/e6a5e8c12a854790a17202b0f262910b",,,,"Une figure droite et princière portant une épée dégainée et correspondant, dans les grandes lignes, à la description traditionnelle que j'ai donnée dans la première partie. Sur les épaules du héros victorieux sont censés se trouver l'Urim et le Thummim. Il a mené la captivité en captivité ; il est la conquête sur tous les plans - dans l'esprit, dans la science, dans le progrès, dans certaines épreuves de l'initiation. Il a ainsi répondu au sphinx, et c'est à ce titre que j'ai accepté la variante d'Éliphas Lévi ; deux sphinx tirent ainsi son char. Il est avant tout le triomphe de l'http://esprit.il/
 faut comprendre pour cela (a) que la question du sphinx porte sur un Mystère de la Nature et non du monde de la Grâce, auquel le char ne pourrait apporter de réponse ; (b) que les plans de sa conquête sont manifestes ou extérieurs et non en lui-même ; (c) que la libération qu'il opère peut se laisser dans la servitude de l'entendement logique ; (d) que les épreuves de l'initiation par lesquelles il est passé en triomphe doivent être comprises physiquement ou rationnellement ; et (e) que s'il s'approchait des piliers de ce Temple entre lesquels la Grande Prêtresse est assise, il ne pourrait pas ouvrir le rouleau appelé Tora, et que si elle l'interrogeait, il ne pourrait pas répondre. Il n'est pas la royauté héréditaire et il n'est pas le sacerdoce.",,"Vie, égo, conscience",0,,7,Sept (https://www.notion.so/Sept-7a90e004895c4c40b98845c975331b5a?pvs=21),✨8,"Être coincé ou passif; Émeute, querelle, dispute, litige, défaite.","Mouvement, contrôle, détermination, aller vers l'inconnu. Succès, providence, guerre, triomphe, présomption, vengeance, trouble.",Travail intérieur,Arcane Majeure : Ligne de Vie,Arcane Majeure : Ligne 1 (https://www.notion.so/Arcane-Majeure-Ligne-1-f39864cb82b24dcd80031d96ebf1e8a4?pvs=21),,,
Cinq d’Epées,"https://www.notion.so/02607a24b1004b958e1fcc325b077d43, https://www.notion.so/0e32926d98784416951ee5af3efd2809, https://www.notion.so/43f0f7a0e8d84ac79ee317ac41b8cc9b, https://www.notion.so/5c8f48d7b6404ac986c87153ccd48660, https://www.notion.so/8d516790c57d45bfb82be0dca4be42ed, https://www.notion.so/ce3debfe0aaf4d279296b9cc563c3cb1",,,,"Un homme dédaigneux regarde deux figures en retrait et abattues. Leurs épées gisent sur le sol. Il en porte deux autres sur son épaule gauche, et une troisième épée est dans sa main droite, pointe vers la terre. Il est le maître en possession du terrain.",🌬Air,"Esprit, Imaginaire, Mental",0,,5,Cinq (https://www.notion.so/Cinq-e1b3287c821e44a2a793a6a1dcbc7e97?pvs=21),✨55,Sortir de l'isolement/libération du ressentiment; La même chose ; l'enterrement et les obsèques.,"Dégradation, destruction, révocation, infamie, déshonneur, perte, avec les variantes et analogues de ceux-ci.","Chrysalide, l'obscurité comme partie de la transformation",Epées,Epées (https://www.notion.so/Ep-es-bcb057fdbc6f4faab96344f1bddec5bc?pvs=21),,,
V Le Hiérophante,"https://www.notion.so/02607a24b1004b958e1fcc325b077d43, https://www.notion.so/0e32926d98784416951ee5af3efd2809, https://www.notion.so/43f0f7a0e8d84ac79ee317ac41b8cc9b, https://www.notion.so/5c8f48d7b6404ac986c87153ccd48660, https://www.notion.so/8d516790c57d45bfb82be0dca4be42ed, https://www.notion.so/ce3debfe0aaf4d279296b9cc563c3cb1",,,,"Il porte la triple couronne et est assis entre deux piliers, mais ce ne sont pas ceux du Temple qui est gardé par la Grande Prêtresse. Dans sa main gauche, il tient un sceptre terminé par la triple croix, et de la main droite, il fait le signe ecclésiastique bien connu, appelé signe de l'ésotérisme, qui distingue la partie manifeste de la partie cachée de la doctrine. Il est à noter à ce propos que la Grande Prêtresse ne fait aucun signe. À ses pieds se trouvent les clés croisées, et deux ministres sacerdotaux en aube sont agenouillés devant lui. On l'a généralement appelé le Pape, ce qui est une application particulière de la fonction plus générale qu'il symbolise. Il est la puissance dominante de la religion extérieure, comme la Grande Prêtresse est le génie dominant de la puissance ésotérique, retirée. Les significations propres de cette carte ont souffert d'un mélange malheureux de presque toutes les mains. Le Grand Orient dit vraiment que le Hiérophante est le pouvoir des clés, de la doctrine orthodoxe exotérique et de la face extérieure de la vie qui mène à la doctrine ; mais il n'est certainement pas le prince de la doctrine occulte, comme l'a suggéré un autre commentateur ; il est plutôt la summa totius theologiæ, lorsqu'elle est passée à la plus grande rigidité d'expression ; mais il symbolise aussi tout ce qui est juste et sacré du côté manifeste. En tant que tel, il est le canal de la grâce appartenant au monde de l'institution, distinct de celui de la nature, et il est le chef du salut pour le genre humain dans son ensemble. Il est l'ordre et le chef de la hiérarchie reconnue, qui est le reflet d'un autre ordre hiérarchique plus grand ; mais il peut arriver que le pontife oublie la signification de cet état symbolique et agisse comme s'il contenait dans ses propres mesures tout ce que son signe signifie ou son symbole cherche à révéler. Il n'est pas, comme on l'a pensé, la philosophie - sauf du côté théologique ; il n'est pas l'inspiration ; et il n'est pas la religion, bien qu'il en soit un mode d'expression.",,"Vie, égo, conscience",0,,5,Cinq (https://www.notion.so/Cinq-e1b3287c821e44a2a793a6a1dcbc7e97?pvs=21),✨6,"Ne pas faire confiance à votre savoir, Société, bonne entente, concorde, excès de gentillesse, faiblesse.","Valeurs, enseignement, tradition, Le mariage, l'alliance, la captivité, la servitude ; par un autre compte, la miséricorde et la bonté ; l'inspiration ; l'homme auquel le Quérant a recours.","Chrysalide, l'obscurité comme partie de la transformation",Arcane Majeure : Ligne de Vie,Arcane Majeure : Ligne 1 (https://www.notion.so/Arcane-Majeure-Ligne-1-f39864cb82b24dcd80031d96ebf1e8a4?pvs=21),,,
