Trois de Coupes,"https://www.notion.so/1256b41e7c4e407fadb601c9fe2c8046, https://www.notion.so/3b83fa022d4f40beb5f8ca2b77d1ca11, https://www.notion.so/4b5761373d044996925088a468f6301c, https://www.notion.so/4dee890fd9924dacb30020920f70dac0, https://www.notion.so/55c7f16955a3471bb1b61a8df7dd8b39, https://www.notion.so/a81e8cdec384425980b56077b8d599cc, https://www.notion.so/fb0a43a12b27490a8496d45e5e405c82",,,,"Des jeunes filles dans un jardin avec des coupes levées, comme pour s'engager l'une envers l'autre.",💧Eau,"Emotions, Relations",1,,3,Trois (https://www.notion.so/Trois-5b61bce79f3347f48d65a28533791737?pvs=21),✨67,"Isolement / dépendance excessive à l'égard des autres; Expédition, envoi, réalisation, fin. Il signifie aussi le côté excessif des jouissances physiques et des plaisirs des sens.","Communauté, soutien. La conclusion de toute affaire dans l'abondance, la perfection et la gaieté ; issue heureuse, victoire, accomplissement, réconfort, guérison,","Synthèse ; connexion de l'esprit, de l'âme et du corps",Coupes,Coupes (https://www.notion.so/Coupes-27f997d58d8d427c917ebcdc8cf6ae77?pvs=21),Tirage du Cœur Estival (https://www.notion.so/Tirage-du-C-ur-Estival-f9ec550a7280458a922eb7cfbaaa88ac?pvs=21),,
Quatre de Bâtons,"https://www.notion.so/32fb62f5a60f4a7cad6342989636fb75, https://www.notion.so/4bb79aec6e064c71828c03ebd42bf035, https://www.notion.so/b54e1fe7547a466f97ad45f7e7385ab5, https://www.notion.so/cf3ef54f956f4748af85d9967365d119, https://www.notion.so/e2924185689b466d99e6a71e9057d2be, https://www.notion.so/f5ff3e27e6274b3d9d2fab6e6cf85751",,,,"Aux quatre grandes douves plantées au premier plan est suspendue une grande guirlande ; deux personnages féminins soulèvent des porte-noix ; à leurs côtés se trouve un pont sur un fossé, menant à une ancienne maison seigneuriale.",🔥 Feu,"Feu, action, créativité",1,,4,Quatre (https://www.notion.so/Quatre-944513e796a64c0b97ca99a25a907ec9?pvs=21),✨26,"Manque de soutien; Le sens reste inchangé ; c'est la prospérité, l'augmentation, la félicité, la beauté, l'embellissement.","Célébration, se sentir bien dans sa peau, Ils sont pour une fois presque à la surface - la vie à la campagne, le refuge, une sorte de récolte domestique - le foyer, le repos, la concorde, l'harmonie, la prospérité, la paix, et l'œuvre perfectionnée de ceux-ci.","Structure, limites, soins personnels",Bâtons,Bâtons (https://www.notion.so/B-tons-bb87bd4935944028bfbf72b7897c337e?pvs=21),Les problèmes de l’été (https://www.notion.so/Les-probl-mes-de-l-t-8f571347361940d99bebe8b1591d7f32?pvs=21),,
Quatre de Coupes,"https://www.notion.so/32fb62f5a60f4a7cad6342989636fb75, https://www.notion.so/4bb79aec6e064c71828c03ebd42bf035, https://www.notion.so/b54e1fe7547a466f97ad45f7e7385ab5, https://www.notion.so/cf3ef54f956f4748af85d9967365d119, https://www.notion.so/e2924185689b466d99e6a71e9057d2be, https://www.notion.so/f5ff3e27e6274b3d9d2fab6e6cf85751",,,,"Un jeune homme est assis sous un arbre et contemple trois tasses posées sur l'herbe devant lui ; un bras sortant d'un nuage lui offre une autre tasse. Malgré tout, son expression est celle d'un mécontentement vis-à-vis de son environnement.",💧Eau,"Emotions, Relations",0,,4,Quatre (https://www.notion.so/Quatre-944513e796a64c0b97ca99a25a907ec9?pvs=21),✨68,"Prendre la responsabilité de choses qui ne vous appartiennent pas; Nouveauté, présage, nouvelle instruction, nouvelles relations.","Délibération, méditation, limites émotionnelles. Lassitude, dégoût, aversion, vexations imaginaires, comme si le vin de ce monde n'avait provoqué que la satiété ; un autre vin, comme un cadeau de fée, est maintenant offert au gaspilleur, mais il n'y voit aucune consolation. C'est aussi une carte du plaisir mélangé.","Structure, limites, soins personnels",Coupes,Coupes (https://www.notion.so/Coupes-27f997d58d8d427c917ebcdc8cf6ae77?pvs=21),,,
Trois de Pentacles,"https://www.notion.so/1256b41e7c4e407fadb601c9fe2c8046, https://www.notion.so/3b83fa022d4f40beb5f8ca2b77d1ca11, https://www.notion.so/4b5761373d044996925088a468f6301c, https://www.notion.so/4dee890fd9924dacb30020920f70dac0, https://www.notion.so/55c7f16955a3471bb1b61a8df7dd8b39, https://www.notion.so/a81e8cdec384425980b56077b8d599cc, https://www.notion.so/fb0a43a12b27490a8496d45e5e405c82",,,,Un sculpteur à son travail dans un monastère. Comparez le dessin qui illustre le huit de pentacle. L'apprenti ou l'amateur a reçu sa récompense et se met sérieusement au travail.,🌱Terre,"Corps, fabrication, rapport aux ressources",0,,3,Trois (https://www.notion.so/Trois-5b61bce79f3347f48d65a28533791737?pvs=21),✨39,"Essayer de le faire seul; Médiocrité, dans le travail et ailleurs, puérilité, mesquinerie, faiblesse.","Travail d'équipe, coopération. Métier, profession, travail qualifié ; généralement, cependant, considéré comme une carte de noblesse, d'aristocratie, de renommée, de gloire.","Synthèse ; connexion de l'esprit, de l'âme et du corps",Pentacles,Pentacles (https://www.notion.so/Pentacles-6dc23f23bede4957b9abf2c636fd3199?pvs=21),,,
Quatre d’Epées,"https://www.notion.so/32fb62f5a60f4a7cad6342989636fb75, https://www.notion.so/4bb79aec6e064c71828c03ebd42bf035, https://www.notion.so/b54e1fe7547a466f97ad45f7e7385ab5, https://www.notion.so/cf3ef54f956f4748af85d9967365d119, https://www.notion.so/e2924185689b466d99e6a71e9057d2be, https://www.notion.so/f5ff3e27e6274b3d9d2fab6e6cf85751",,,,"L'effigie d'un chevalier dans l'attitude de la prière, en pied sur sa tombe.",🌬Air,"Esprit, Imaginaire, Mental",0,,4,Quatre (https://www.notion.so/Quatre-944513e796a64c0b97ca99a25a907ec9?pvs=21),✨54,"Répit/brûlure; Administration sage, circonspection, économie, avarice, précaution, testament.","Restauration. Vigilance, retraite, solitude, repos de l'ermite, exil, tombe et cercueil. Ce sont ces derniers qui ont suggéré le dessin.","Structure, limites, soins personnels",Epées,Epées (https://www.notion.so/Ep-es-bcb057fdbc6f4faab96344f1bddec5bc?pvs=21),,,
XVIII La Lune,"https://www.notion.so/30f59c0f4dd54af4ab2ecb9229fc6423, https://www.notion.so/81486c11e9f74d40866624d6e245e7c8, https://www.notion.so/8e82231fe1f84fe596700cf4ffe5de92, https://www.notion.so/d35ac4e06a4544769b7343950db70a31, https://www.notion.so/db9bdef69fa543ac9e602924e88d8e2f, https://www.notion.so/ec2fb8726d9c4fb995fb63f4cfcd8172",,,,"La distinction entre cette carte et certains des types conventionnels est que la lune est croissante sur ce qu'on appelle le côté de la pitié, à droite de l'observateur. Elle possède seize rayons principaux et seize rayons secondaires. Cette carte représente la vie de l'imagination en dehors de la vie de l'esprit. Le chemin entre les tours est la sortie vers l'inconnu. Le chien et le loup sont les peurs de l'esprit naturel en présence de ce lieu de sortie, lorsqu'il n'y a que la lumière réfléchie pour le http://guider.la/
 dernière référence est une clé pour une autre forme de symbolisme. Cette dernière référence est la clé d'une autre forme de symbolisme. La lumière intellectuelle est un reflet et au-delà d'elle se trouve le mystère inconnu qu'elle ne peut dévoiler. Elle éclaire notre nature animale, dont les types sont représentés ci-dessous - le chien, le loup et ce qui sort des profondeurs, la tendance sans nom et hideuse qui est inférieure à la bête sauvage. Elle s'efforce d'atteindre la manifestation, symbolisée par le fait de ramper de l'abîme de l'eau jusqu'à la terre, mais en règle générale, elle retombe d'où elle est venue. Le visage de l'esprit dirige un regard calme sur l'agitation qui règne en bas ; la rosée de la pensée tombe ; le message est : Et il se peut qu'un calme s'installe sur la nature animale, tandis que l'abîme en dessous cessera de donner une forme.",,"Renaissance, émergence",0,,18,Neuf (https://www.notion.so/Neuf-3e80e97e22564b17bc1343bdb2242adb?pvs=21),✨19,"Confusion, clarté; L'instabilité, l'inconstance, le silence, des degrés moindres de tromperie et d'erreur.","Illusion, subconscient, Ennemis cachés, danger, calomnie, ténèbres, terreur, tromperie, forces occultes, erreur.",Intégration des enseignements tirés des autres numéros,Arcane Majeure : Spirale de Renaissance,Arcane Majeure : 3ème Ligne (https://www.notion.so/Arcane-Majeure-3-me-Ligne-7826df0c5a0f44b6a7670726a851e93a?pvs=21),,,
As de Pentacles,"https://www.notion.so/130805d5f8c54825a7c8a61682882c01, https://www.notion.so/27d5ca59365c435f89c4121027368a3c, https://www.notion.so/34165b0a55984ba0ba00fa134ff5cb79, https://www.notion.so/8e930ab535b74904bbd4b2db25eb0429, https://www.notion.so/a991a1b7910240059ea2fa497a28eddc, https://www.notion.so/c828903eafcb45789c616d561264a598, https://www.notion.so/e11f7e97f22a4da0977fea4e9f1bc706",,,,"Une main - sortant, comme d'habitude, d'un nuage - tient un pentacle.",🌱Terre,"Corps, fabrication, rapport aux ressources",0,,1,As/Un (https://www.notion.so/As-Un-291bbf0a48234c84be0a32df14f72e31?pvs=21),✨37,"Ne pas voir les opportunités; Le mauvais côté de la richesse, la mauvaise intelligence ; également les grandes richesses. Dans tous les cas, elle indique la prospérité, des conditions matérielles confortables, mais le fait qu'elles soient avantageuses pour le possesseur dépendra du fait que la carte soit inversée ou non.","Nouvelles opportunités, manifestation. Contentement parfait, félicité, extase ; aussi intelligence rapide ; or.","Une invitation à prendre vos outils, à la magie personnelle, aux capacités infinies, au partage des messages.",Pentacles,Pentacles (https://www.notion.so/Pentacles-6dc23f23bede4957b9abf2c636fd3199?pvs=21),,,
Cinq de Pentacles,"https://www.notion.so/02607a24b1004b958e1fcc325b077d43, https://www.notion.so/0e32926d98784416951ee5af3efd2809, https://www.notion.so/43f0f7a0e8d84ac79ee317ac41b8cc9b, https://www.notion.so/5c8f48d7b6404ac986c87153ccd48660, https://www.notion.so/8d516790c57d45bfb82be0dca4be42ed, https://www.notion.so/ce3debfe0aaf4d279296b9cc563c3cb1",,,,Deux mendiants dans une tempête de neige passent devant un battant éclairé.,🌱Terre,"Corps, fabrication, rapport aux ressources",0,,5,Cinq (https://www.notion.so/Cinq-e1b3287c821e44a2a793a6a1dcbc7e97?pvs=21),✨41,"Sortir de la pénurie; Désordre, chaos, ruine, discorde, prodigalité.","L'esprit de pénurie. Cette carte présage surtout des ennuis matériels, que ce soit sous la forme illustrée - c'est-à-dire la misère - ou autrement. Pour certains cartomanciens, c'est une carte d'amour et d'amants - femme, mari, ami, maîtresse - mais aussi de concordance, d'affinités. Ces alternatives ne peuvent être harmonisées.","Chrysalide, l'obscurité comme partie de la transformation",Pentacles,Pentacles (https://www.notion.so/Pentacles-6dc23f23bede4957b9abf2c636fd3199?pvs=21),,,
XI La Justice,"https://www.notion.so/45dcdc05ce5143f39a175c8a0c248044, https://www.notion.so/6b332450c461455ea8b55a3c2d44a732, https://www.notion.so/7d601c69d2204d5e8caf5f41a24d6ec0, https://www.notion.so/90262c49ad634373865b83f7c2e9c3ec, https://www.notion.so/a85d694b6bce437ea2304bf23dbfdccb, https://www.notion.so/b06474f617794d3490c3d30c6169cda7, https://www.notion.so/fbaaf63b7e954ea999d02b37912624da",,,,"Comme cette carte suit le symbolisme traditionnel et porte surtout ses significations évidentes, il n'y a pas grand-chose à dire à son sujet en dehors des quelques considérations recueillies dans la première partie, à laquelle le lecteur est renvoyé.On verra cependant que la figure est assise entre des piliers, comme la Grande Prêtresse, et à ce titre il semble souhaitable d'indiquer que le principe moral qui traite chaque homme selon ses œuvres - tout en étant, bien sûr, en stricte analogie avec les choses supérieures - diffère dans son essence de la justice spirituelle qui est impliquée dans l'idée d'élection. Cette dernière appartient à un ordre mystérieux de la Providence, en vertu duquel il est possible à certains hommes de concevoir l'idée de consécration aux choses les plus élevées. L'opération de celle-ci est comme la respiration de l'Esprit où il veut, et nous n'avons à son sujet aucun canon de critique ni aucun motif d'explication. Elle est analogue à la possession des dons féeriques, des dons élevés et des dons gracieux du poète : nous les avons ou nous ne les avons pas, et leur présence est aussi mystérieuse que leur absence. La loi de la Justice n'est cependant impliquée par aucune des deux alternatives. En conclusion, les piliers de la Justice ouvrent sur un monde et les piliers de la Grande Prêtresse sur un autre.",,"Transformation, lâcher-prise, approfondissement, l'inconscient",0,,11,Deux (https://www.notion.so/Deux-2fc9d09967e54e819d63befe47b36334?pvs=21),✨12,"Malhonnêteté, injustice; Le droit dans tous ses départements, les complications juridiques, le sectarisme, les préjugés, la sévérité excessive.","Vérité, harmonie, Équité, droit, probité, exécutif ; triomphe du côté méritant en droit.","Dualité, Intuition",Arcane Majeure : Ligne de Mort,Arcane Majeure : 2ème ligne (https://www.notion.so/Arcane-Majeure-2-me-ligne-97dab140117e45a3a8a808994b8d07fe?pvs=21),,,
III L’Impératrice,"https://www.notion.so/1256b41e7c4e407fadb601c9fe2c8046, https://www.notion.so/3b83fa022d4f40beb5f8ca2b77d1ca11, https://www.notion.so/4b5761373d044996925088a468f6301c, https://www.notion.so/4dee890fd9924dacb30020920f70dac0, https://www.notion.so/55c7f16955a3471bb1b61a8df7dd8b39, https://www.notion.so/a81e8cdec384425980b56077b8d599cc, https://www.notion.so/fb0a43a12b27490a8496d45e5e405c82",,,,"Une figure majestueuse, assise, avec de riches vêtements et un aspect royal, comme une fille du ciel et de la terre. Son diadème est composé de douze étoiles, réunies en une grappe. Le symbole de Vénus est sur le bouclier qui repose près d'elle. Devant elle, un champ de blé mûrit et, au-delà, il y a une chute d'eau. Le sceptre qu'elle porte est surmonté du globe de ce monde. Elle est le jardin d'Eden inférieur, le Paradis terrestre, tout ce qui est symbolisé par la maison visible de l'homme. Elle n'est pas Regina coeli, mais elle est encore refugium peccatorum, la mère féconde de milliers de personnes. Il y a aussi certains aspects dans lesquels elle a été correctement décrite comme le désir et ses ailes, comme la femme revêtue du soleil, comme le Gloria Mundi et le voile du Sanctum Sanctorum ; mais elle n'est pas, ajouterai-je, l'âme qui a atteint les ailes, à moins que tout le symbolisme ne soit compté d'une manière différente et inhabituelle. Elle est avant tout la fécondité universelle et le sens extérieur du Verbe. Dans un autre ordre d'idées, la carte de l'Impératrice signifie la porte ou le portail par lequel on entre dans cette vie, comme dans le jardin de Vénus ; puis le chemin qui en sort, vers l'au-delà, est le secret connu de la Grande Prêtresse : il est communiqué par elle aux élus. La plupart des anciennes attributions de cette carte sont complètement erronées en ce qui concerne le symbolisme - comme, par exemple, son identification avec le Verbe, la Nature divine, la Triade, etc.",,"Vie, égo, conscience",0,,3,Trois (https://www.notion.so/Trois-5b61bce79f3347f48d65a28533791737?pvs=21),✨4,"Lutte avec la réception, état d'esprit de rareté, La lumière, la vérité, le démêlage des affaires en cours, les réjouissances publiques ; selon une autre lecture, l'hésitation.","Réceptivité, abondance, énergie féminine, connexion aux 5 sens, La fécondité, l'action, l'initiative, la longueur des jours ; l'inconnu, le clandestin ; aussi la difficulté, le doute, l'ignorance.","Synthèse ; connexion de l'esprit, de l'âme et du corps",Arcane Majeure : Ligne de Vie,Arcane Majeure : Ligne 1 (https://www.notion.so/Arcane-Majeure-Ligne-1-f39864cb82b24dcd80031d96ebf1e8a4?pvs=21),,,
Roi d’Epées,"https://www.notion.so/0e7ef84f1d7c4211898fc0ad598b0f09, https://www.notion.so/59c183dcf98947f1a886fd2212a0c1b2, https://www.notion.so/9e8957fe4c054bc0bef907d6a3f42fbc, https://www.notion.so/db348cc2dbfd4495885168a5fec2ba17",,,,"Il siège en tant que juge, tenant le signe de son costume non dégainé. Il rappelle, bien sûr, le symbole conventionnel de la justice dans les Atouts majeurs, et il peut représenter cette vertu, mais il est plutôt le pouvoir de vie et de mort, en vertu de sa fonction.",🌬Air,"Esprit, Imaginaire, Mental",0,,14,Rois (https://www.notion.so/Rois-d1cba03a95144655aed1ef253fd839f4?pvs=21),✨64,"Manipulation; Cruauté, perversité, barbarie, perfidie, mauvaise intention.","Dire la vérité, s'exprimer clairement. Tout ce qui découle de l'idée de jugement et de toutes ses connexions - pouvoir, commandement, autorité, intelligence militante, loi, offices de la couronne, etc.",Concrétisation,Epées,Epées (https://www.notion.so/Ep-es-bcb057fdbc6f4faab96344f1bddec5bc?pvs=21),,,
Deux de Bâtons,"https://www.notion.so/45dcdc05ce5143f39a175c8a0c248044, https://www.notion.so/6b332450c461455ea8b55a3c2d44a732, https://www.notion.so/7d601c69d2204d5e8caf5f41a24d6ec0, https://www.notion.so/90262c49ad634373865b83f7c2e9c3ec, https://www.notion.so/a85d694b6bce437ea2304bf23dbfdccb, https://www.notion.so/b06474f617794d3490c3d30c6169cda7, https://www.notion.so/fbaaf63b7e954ea999d02b37912624da",,,,"Un homme de grande taille regarde la mer et le rivage depuis un toit crénelé ; il tient un globe dans sa main droite, tandis qu'un bâton dans sa main gauche repose sur le créneau ; un autre est fixé dans un anneau. On remarque la rose, la croix et le lys sur le côté gauche.",🔥 Feu,"Feu, action, créativité",0,,2,Deux (https://www.notion.so/Deux-2fc9d09967e54e819d63befe47b36334?pvs=21),✨24,"La procrastination ou le fait de se lancer avant d'être prêt. Surprise, émerveillement, enchantement, émotion, trouble, peur.","Préparation, décisions, Entre les lectures alternatives, il n'y a pas de mariage possible ; d'un côté, la richesse, la fortune, la magnificence ; de l'autre, la souffrance physique, la maladie, le chagrin, la tristesse, la mortification. Le dessin donne une suggestion ; voici un seigneur qui surplombe sa domination et contemple alternativement un globe terrestre ; on dirait la maladie, la mortification, la tristesse d'Alexandre au milieu de la grandeur des richesses de ce monde.","Dualité, Intuition",Bâtons,Bâtons (https://www.notion.so/B-tons-bb87bd4935944028bfbf72b7897c337e?pvs=21),,,
Deux d’Epées,"https://www.notion.so/45dcdc05ce5143f39a175c8a0c248044, https://www.notion.so/6b332450c461455ea8b55a3c2d44a732, https://www.notion.so/7d601c69d2204d5e8caf5f41a24d6ec0, https://www.notion.so/90262c49ad634373865b83f7c2e9c3ec, https://www.notion.so/a85d694b6bce437ea2304bf23dbfdccb, https://www.notion.so/b06474f617794d3490c3d30c6169cda7, https://www.notion.so/fbaaf63b7e954ea999d02b37912624da",,,,Une silhouette de femme encapuchonnée porte deux épées en équilibre sur ses épaules.,🌬Air,"Esprit, Imaginaire, Mental",0,,2,Deux (https://www.notion.so/Deux-2fc9d09967e54e819d63befe47b36334?pvs=21),✨52,"Regarder à l'extérieur pour trouver les réponses, esprit de décision; Imposture, fausseté, duplicité, déloyauté.","Méditation/choix entre les voies. La conformité et l'équilibre qu'elle suggère, le courage, l'amitié, la concorde dans un état d'armes ; une autre lecture donne la tendresse, l'affection, l'intimité. La suggestion d'harmonie et les autres lectures favorables doivent être considérées avec réserve, car les épées ne symbolisent généralement pas les forces bénéfiques dans les affaires humaines.","Dualité, Intuition",Epées,Epées (https://www.notion.so/Ep-es-bcb057fdbc6f4faab96344f1bddec5bc?pvs=21),,,
XIII La Mort,"https://www.notion.so/32fb62f5a60f4a7cad6342989636fb75, https://www.notion.so/4bb79aec6e064c71828c03ebd42bf035, https://www.notion.so/b54e1fe7547a466f97ad45f7e7385ab5, https://www.notion.so/cf3ef54f956f4748af85d9967365d119, https://www.notion.so/e2924185689b466d99e6a71e9057d2be, https://www.notion.so/f5ff3e27e6274b3d9d2fab6e6cf85751",,,,"Le voile ou le masque de la vie se perpétue dans le changement, la transformation et le passage d'un niveau inférieur à un niveau supérieur, ce qui est mieux représenté dans le Tarot rectifié par l'une des visions apocalyptiques que par la notion grossière du squelette fauché. Derrière elle se cache tout le monde de l'ascension dans l'esprit. Le mystérieux cavalier avance lentement, portant une bannière noire sur laquelle est inscrite la Rose Mystique, qui signifie la vie. Entre deux piliers, au bord de l'horizon, brille le soleil de l'immortalité. Le cavalier ne porte aucune arme visible, mais le roi, l'enfant et la jeune fille tombent devant lui, tandis qu'un prélat, les mains jointes, attend sa http://fin.il/
 n'est pas nécessaire de préciser que la suggestion de la mort que j'ai faite à propos de la carte précédente doit, bien entendu, être comprise de façon mystique, mais ce n'est pas le cas ici. Le passage naturel de l'homme au stade suivant de son être est ou peut être une forme de son progrès, mais l'entrée exotique et presque inconnue, alors qu'il est encore dans cette vie, dans l'état de mort mystique est un changement dans la forme de la conscience et le passage dans un état vers lequel la mort ordinaire n'est ni le chemin ni la porte. Les explications occultes existantes de la 13e carte sont, dans l'ensemble, meilleures que les habituelles, renaissance, création, destination, renouvellement, et le reste.",,"Transformation, lâcher-prise, approfondissement, l'inconscient",0,,13,Quatre (https://www.notion.so/Quatre-944513e796a64c0b97ca99a25a907ec9?pvs=21),✨14,"Stagnation, peur du changement; Inertie, sommeil, léthargie, pétrification, somnambulisme ; espoir détruit.","Métamorphose, transformation, fin, mortalité, destruction, corruption aussi, pour un homme, la perte d'un bienfaiteur ; pour une femme, de nombreuses contrariétés ; pour une jeune fille, l'échec des projets de mariage.","Structure, limites, soins personnels",Arcane Majeure : Ligne de Mort,Arcane Majeure : 2ème ligne (https://www.notion.so/Arcane-Majeure-2-me-ligne-97dab140117e45a3a8a808994b8d07fe?pvs=21),,,
Six d’Epées,"https://www.notion.so/2d2b37fc265745008eb73475092a4278, https://www.notion.so/4709ecb04be74dc8b530e7d7fd7dcc71, https://www.notion.so/51331b416be648c78509bc7448548291, https://www.notion.so/8b38a428641b4738ac23d4deca431b0f, https://www.notion.so/dd67761b50d34651a928c20f94110a96, https://www.notion.so/f9db2aadbec64204887e60a0a9f8ad55",,,,"Un passeur transporte des passagers dans sa barque jusqu'à la rive opposée. Le parcours est régulier, et comme le chargement est léger, on peut noter que le travail n'est pas au-dessus de ses forces.",🌬Air,"Esprit, Imaginaire, Mental",0,,6,Six (https://www.notion.so/Six-7dc5f0e583094f4481277414c377ddc8?pvs=21),✨56,"Transport de bagages; Déclaration, confession, publicité ; un compte rendu dit qu'il s'agit d'une proposition d'amour.","Transition, changement. voyage par voie d'eau, route, chemin, envoyé, commissionnaire, expédient.","Expansion, créativité, sortie de la chrysalide",Epées,Epées (https://www.notion.so/Ep-es-bcb057fdbc6f4faab96344f1bddec5bc?pvs=21),,,
As de Coupes,"https://www.notion.so/130805d5f8c54825a7c8a61682882c01, https://www.notion.so/27d5ca59365c435f89c4121027368a3c, https://www.notion.so/34165b0a55984ba0ba00fa134ff5cb79, https://www.notion.so/8e930ab535b74904bbd4b2db25eb0429, https://www.notion.so/a991a1b7910240059ea2fa497a28eddc, https://www.notion.so/c828903eafcb45789c616d561264a598, https://www.notion.so/e11f7e97f22a4da0977fea4e9f1bc706",,,,"Les eaux sont au-dessous, et sur elles se trouvent des nénuphars ; la main sort du nuage, tenant dans sa paume la coupe, d'où coulent quatre ruisseaux ; une colombe, portant dans son bec une hostie marquée d'une croix, descend pour placer l'hostie dans la coupe ; la rosée de l'eau tombe de tous côtés. C'est une indication de ce qui peut se cacher derrière les arcanes mineurs.",💧Eau,"Emotions, Relations",0,,1,As/Un (https://www.notion.so/As-Un-291bbf0a48234c84be0a32df14f72e31?pvs=21),✨65,"Emotions bloquées; Maison du faux cœur, mutation, instabilité, révolution.","Honorer ses émotions. Maison du vrai cœur, joie, contentement, demeure, nourriture, abondance, fertilité ; Table sainte, félicité de celle-ci.","Une invitation à prendre vos outils, à la magie personnelle, aux capacités infinies, au partage des messages.",Coupes,Coupes (https://www.notion.so/Coupes-27f997d58d8d427c917ebcdc8cf6ae77?pvs=21),,,
